{
  "$schema": "https://json-schema.org/draft/2020-12/schema",
  "$id": "strategy-brief.schema.json",
  "title": "StrategyBrief",
  "description": "Minimal output of incentive-strategy-planner. It tells the page builder who the campaign is for, where it runs, what it should achieve, and which page structure to use.",
  "type": "object",
  "required": [
    "schema_version",
    "artifact_type",
    "producer_skill",
    "target_skill",
    "status",
    "target_user",
    "region",
    "campaign_goal",
    "page_structure",
    "assumptions",
    "open_questions"
  ],
  "properties": {
    "schema_version": { "type": "string", "pattern": "^1\\." },
    "artifact_type": { "const": "strategy_brief" },
    "producer_skill": { "const": "incentive-strategy-planner" },
    "target_skill": { "const": "vibe-activity-page" },
    "status": { "enum": ["draft", "ready", "blocked"] },
    "target_user": {
      "type": "object",
      "description": "Structured audience profile.",
      "required": [
        "segment",
        "age",
        "gender",
        "identity",
        "traits"
      ],
      "properties": {
        "segment": {
          "type": "string",
          "description": "High-level audience segment, for example new_users, existing_users, dormant_users."
        },
        "age": {
          "type": "string",
          "description": "Age range or age description."
        },
        "gender": {
          "type": "string",
          "description": "Gender targeting."
        },
        "identity": {
          "type": "string",
          "description": "User identity, role, or life context, for example students, young parents, creators."
        },
        "traits": {
          "type": "array",
          "description": "Known behavioral, motivational, or consumption traits.",
          "items": { "type": "string" }
        }
      },
      "additionalProperties": false
    },
    "region": {
      "type": "string",
      "description": "The market or region where the campaign runs, for example Brazil."
    },
    "campaign_goal": {
      "type": "string",
      "description": "The primary business goal, for example new_user_acquisition, referral_growth, cashout_activation."
    },
    "page_structure": {
      "type": "object",
      "description": "Selected page framework and the content blocks the page builder should include.",
      "required": [
        "type",
        "contents"
      ],
      "properties": {
        "type": {
          "type": "string",
          "description": "The page framework selected for build, for example single-gameplay-conversion-page."
        },
        "contents": {
          "type": "array",
          "description": "Page content blocks.",
          "items": {
            "type": "object",
            "required": [
              "id",
              "name",
              "description"
            ],
            "properties": {
              "id": {
                "type": "string",
                "description": "Stable block id, for example header_area, reward_status_card, gameplay_area, action_area."
              },
              "name": {
                "type": "string",
                "description": "Human-readable block name."
              },
              "description": {
                "type": "string",
                "description": "What this block should communicate or contain."
              },
              "fixed": {
                "type": "boolean",
                "description": "Whether this block should follow a strict component contract."
              }
            },
            "additionalProperties": false
          }
        }
      },
      "additionalProperties": false
    },
    "notes": {
      "type": "array",
      "items": { "type": "string" },
      "default": []
    },
    "assumptions": {
      "type": "array",
      "items": { "type": "string" }
    },
    "open_questions": {
      "type": "array",
      "items": { "type": "string" }
    }
  },
  "additionalProperties": false
}
